id,tweet_text,tweet_created,source,favorite_count,retweet_count
1192136659287982081, educ2502019 teambsubstanceabuse Fact In a 2012 2013 survey administered by Health Canada 13 of students in gra ,2019-11-06 17:48:23,Twitter for Android,0,0
1192136657044029440,,2019-11-06 17:48:22,Twitter for iPad,0,12
1192136656683327490,Homelessness is lethal caeh19 ,2019-11-06 17:48:22,Twitter for iPhone,0,35
1192136656528130048,,2019-11-06 17:48:22,Twitter for iPhone,0,0
1192136655735422976,2 Many ISI agents arr ,2019-11-06 17:48:22,Twitter for Android,0,448
1192136655488126976, Cptnrwrpnts JulieCllloyd maybe it means something different in Canada,2019-11-06 17:48:22,Twitter Web App,1,0
1192136651113254912,2 Many ISI agents arr ,2019-11-06 17:48:21,Twitter for Android,0,448
1192136645446787072,Trudeau s an absolute loser always holidaying turning Canada into a Third World Country Everyone on Welfare ove ,2019-11-06 17:48:19,Twitter for iPad,0,0
1192136642707853312,RT MarvelStudios Oh snap Avengers Endgame is coming to DisneyPlus Start streaming the epic finale to Marvel Studios Infinity Saga on ,2019-11-06 17:48:19,Twitter for iPhone,0,1261
1192136637335134210,Top prizes include 10 000 000 bribes for witnesses a free trip to Canada unlimited hookers and blow include ,2019-11-06 17:48:17,Twitter for Android,0,272
1192136636445970434,The fact that they re spoofing legitimate numbers is alarming ,2019-11-06 17:48:17,Twitter for Android,1,0
1192136636387086336,Imagine if an ,2019-11-06 17:48:17,Twitter for Android,0,111
1192136635972014081,Complex ,2019-11-06 17:48:17,Twitter for Android,0,81
1192136633845465094,RT cravecreative TomTSEC Because nothing says Welcome to Canada like shoving 400 new immigrants into the same building like a bunch of ,2019-11-06 17:48:16,Twitter for Android,0,15
1192136633434411008,RT PnPCBC Prime Minister Justin Trudeau said today Canadian beef and pork exports to China will resume ending a nearly four month long t ,2019-11-06 17:48:16,Twitter for Android,0,112
1192136632700428290,RT AIC CEO Thanks to MPP FaisalHassanNDP for a very productive discussion today and for the chance to share the perspectives of AIC Can ,2019-11-06 17:48:16,Twitter for iPhone,0,4
1192136630938681345,RT Spin Assassin Part of why Canada is broken is because the people themselves have also changed Corrupt people elect corrupt government ,2019-11-06 17:48:16,Twitter for Android,0,33
1192136629697142784, CanadaRemembers,2019-11-06 17:48:16,Twitter for iPhone,0,974
1192136629542178816, tedlieu realDonaldTrump Dems are fighting to make our health care like UK or Canada where you wait for 6 months ,2019-11-06 17:48:15,Twitter Web App,0,0
1192136623657553923,RT BBCWorld Trump impeachment hearings to go public next week ,2019-11-06 17:48:14,Twitter for Android,0,190
1192136620851572736, betsywbee TheManFromAunt WBrettWilson We kept our identity because at the time we were a majority in Lower Ca ,2019-11-06 17:48:13,Twitter Web App,0,0
1192136611984601088,RT fadeinsoftware Please do not put yourselves in a situation like Canada where you can just skip willy nilly off to the doctor raising ,2019-11-06 17:48:11,Twitter for iPhone,0,183
1192136608981504002,2 Many ISI agents arr ,2019-11-06 17:48:11,Twitter Web App,0,448
1192136608251703296, Forging new ground Squamish Nation planning 11 towers next to Burrard Bridge ,2019-11-06 17:48:10,Twitter Web Client,0,0
1192136606398001153,RT pressfreedom Authorities in the Six Nations Territory in Canada should conduct a prompt and thorough investigation into an arson atta ,2019-11-06 17:48:10,Twitter for iPhone,0,8
1192136604326023168,RT NHenryFundi There has to be a reckoning of the fact that race and racism are part of the establishment amp maintenance of public educati ,2019-11-06 17:48:09,Twitter for Android,0,12
1192136601448648710,RT MaryamMonsef We must all do our part to combat climate change Random Acts of Green s mobile app provides environmentally friendly tip ,2019-11-06 17:48:09,TweetDeck,0,4
1192136599745679360,2 Many ISI agents arr ,2019-11-06 17:48:08,Twitter for Android,0,448
1192136599301050368, DanksterT Piggotto Care to share a source that proves men are more competitive Sacha Hostyn won the National S ,2019-11-06 17:48:08,Twitter Web Client,0,0
1192136596671254528,Joshua Gold Resources is a US gold exploration company headquartered in Canada engaged in the exploration of highl ,2019-11-06 17:48:08,Twitter Web App,0,0
1192136596545572864, likeforlikes like4follow followforfollowbak follows rows billionaireambitions usa australia austria ,2019-11-06 17:48:08,Twitter for Android,1,0
1192136595585015808,RT MyCorporation Microsmallbusi1 Startup Canada scotiabank This is a great tip Focus on ways you can better personalize the customer ,2019-11-06 17:48:07,Twitter Web App,0,1
1192136594746150912, SaskSneeze Good thing governments across western canada got together and put out manditory semi truck training checks notes oh wait,2019-11-06 17:48:07,Twitter Web App,1,0
1192136592162525184, Immigrants of Canada s past were settlers and pionee ,2019-11-06 17:48:07,Twitter for iPhone,0,203
1192136591684145153,2 Many ISI agents arr ,2019-11-06 17:48:06,Twitter for Android,0,448
1192136589763317760,the rehab es ,2019-11-06 17:48:06,Twitter for iPhone,0,494
1192136585627807745,RT Mr H Teacher A great morning at the Royal Canadian Regiment Museum We learned about conflict amp change in Canada over the past centur ,2019-11-06 17:48:05,Twitter for iPhone,0,1
1192136584608411649, JacquelineMaley My mother s friend a Greek woman then in her sixties went to Canada in the mid 1990s to see him p ,2019-11-06 17:48:05,Twitter for iPad,0,0
1192136584239423488,RT long daze Please retweet and inform I personally know a couple of seniors who fell vulnerable to this scam ,2019-11-06 17:48:05,Twitter for Android,0,9
1192136581374730240, graymalkin26 jeremycorbyn GSpellchecker Why did Canada just vote when we already voted 4 years ago ,2019-11-06 17:48:04,Twitter for iPhone,0,0
1192136578870722566,RT BBCWorld Virginia elects woman fired for giving President Trump the finger ,2019-11-06 17:48:03,Twitter for iPhone,0,557
1192136578426179584, Tap to expand ,2019-11-06 17:48:03,Twitter Web App,0,440
1192136576110714880, ICEgov Also a wall doesn t work when you can just hop on a flight to Canada w o a visa and walk across the totally ,2019-11-06 17:48:03,Twitter Web App,0,0
1192136574261051392, KejeraL drewmagary Here in Canada it is one of the complaints from some people about our health care system tha ,2019-11-06 17:48:02,Twitter for iPhone,0,0
1192136571778162688,My ML ,2019-11-06 17:48:02,Twitter for iPhone,0,4
1192136571329236993,RT invigilator4 ParmarLisa CanArm2011 AndrewScheer presscoreca KieserBill MrStache9 Spin Assassin Ben Aissa was later extradited ,2019-11-06 17:48:02,Twitter for iPad,0,1
1192136571077701632,Congratulations to RustumSouthwell BlackBusinessNS recipient of the 2019 National startup canada Adam Chowaniec ,2019-11-06 17:48:02,CoSchedule,1,0
1192136570880643072,RT cathmckenna President Trump s announcement that the US will walk away from the Paris Agreement is disappointing However no one count ,2019-11-06 17:48:01,Twitter for iPhone,0,327
1192136570788352000,My cousin got diagnosed with cancer stage 4 with lymphoblastic lyphoma My aunt is a single mother with 4 ,2019-11-06 17:48:01,Twitter for iPhone,0,42
1192136567340617729, Startup Canada scotiabank A9 It s a evolving process Continuous market and competitor learning analysis is key ,2019-11-06 17:48:01,Twitter for iPhone,1,1
1192136566975500293,RT CBCNews A new Ontario help line offers support to stressed out and emotionally fatigued caregivers ,2019-11-06 17:48:01,Twitter Web App,0,82
1192136565855666176,2 Many ISI agents arr ,2019-11-06 17:48:00,Twitter for Android,0,448
1192136563351785473,RT kimorlesky Startup Canada scotiabank A8 Gartner inc 89 of companies expect to compete entirely on customer experience which mea ,2019-11-06 17:48:00,Twitter Web App,0,1
1192136559862132736, Starbucks Why is the Gingerbread Latte only available in Canada ,2019-11-06 17:47:59,Twitter for iPhone,0,0
1192136558465470464, BrendonBernard on how Canada s job gain streak can continue because of Ontario s lower relative employment rate ,2019-11-06 17:47:59,Twitter Web App,0,0
1192136556456398850, kpac 15 BestStephen DarrenB72821979 Linny306Linda Alberta does lead Canada number one in per capita GDP as an ,2019-11-06 17:47:58,Twitter for iPhone,0,0
1192136555076317184, CanadaRemembers,2019-11-06 17:47:58,Twitter for Android,0,974
1192136554929512449,RT envirodefence 11 000 scientists from 153 countries have called a climate emergency Canada and other countries needs to pick up the ,2019-11-06 17:47:58,Twitter Web App,0,2
1192136548818407424,RT TrevorRobb Andrew Scheer s days are numbered 42 want him gone new poll finds ,2019-11-06 17:47:56,Twitter for iPhone,0,2
1192136543365976065, JrGellein The vetting process for refugees immigrants in Canada has fallen apart under Trudeau s Liberal gov t T ,2019-11-06 17:47:55,Twitter Web App,0,0
1192136542258679810,RT ArleneDickinson Canada is not perfect but it s an amazing country Separating from it makes no sense we re stronger as a country tog ,2019-11-06 17:47:55,Twitter for Android,0,69
1192136533584670720,RT SpeakUp407 ElkeBabiuk Postmedia needs to be ejected from Canada Fucking American owned media meddling in Canadian political issues ,2019-11-06 17:47:53,Twitter Web App,0,6
1192136529558167552,RT ccdonline Have an accessibility related complaint about federally regulated transportation services in Canada Submit it using CTA s ,2019-11-06 17:47:52,Twitter for iPad,0,2
1192136527725379584,Every other place they have hate speech laws mass immigration no guns etc,2019-11-06 17:47:51,Twitter Web App,0,0
1192136527633092609,BREAKING Here s what Canada said to a reporter about homework North Korea finished eating national debt ,2019-11-06 17:47:51,FactsCreatorBot,0,1
1192136526517407746,RT MarvelStudios Oh snap Avengers Endgame is coming to DisneyPlus Start streaming the epic finale to Marvel Studios Infinity Saga on ,2019-11-06 17:47:51,Twitter for Android,0,1261
1192136522033532928,RT derrickokeefe The area the Squamish will now be developing is but a small portion of their lands from which they were forcibly removed ,2019-11-06 17:47:50,Twitter Web App,0,3
1192136513833725953,RT Starbucks Turn on your cheer the holidays are back tomorrow Nov 7 Purchase a handcrafted holiday beverage and get a Reusable R ,2019-11-06 17:47:48,Twitter for iPhone,0,752
1192136512395206658,RT Jon Dunnett If you re in Atlantic Canada and want to be able to handle the toughest of boardroom negotiations join us on Nov 14 15 at ,2019-11-06 17:47:48,Twitter Web App,0,4
1192136510159511553,RT JustinTrudeau Had a good meeting with RepRichardNeal and his colleagues from the Ways amp Means Committee today We talked about the jo ,2019-11-06 17:47:47,Twitter for iPhone,0,22
1192136509371158530,RT MediaSmarts Looking for more ways to teach your students about digital citizenship Here s a brand new and free resource we develop ,2019-11-06 17:47:47,Twitter for iPhone,0,12
1192136504027570178,RT JustinTrudeau Had a good meeting with RepRichardNeal and his colleagues from the Ways amp Means Committee today We talked about the jo ,2019-11-06 17:47:46,Twitter Web App,0,22
1192136503583027205,Aurora Kiss is designed by Yellow Knives ,2019-11-06 17:47:45,Instagram,0,0
1192136502085636098,France ,2019-11-06 17:47:45,Twitter for iPhone,0,1050
1192136500537774081,2 Many ISI agents arr ,2019-11-06 17:47:45,Twitter for Android,0,448
1192136497941663744,RT Marvel Oh snap AvengersEndgame is coming to DisneyPlus Start streaming the epic finale to Marvel Studios Infinity Saga on Novembe ,2019-11-06 17:47:44,Twitter for iPhone,0,445
1192136496351862784,Joshua Gold Resources is a US gold exploration company headquartered in Canada engaged in the exploration of highl ,2019-11-06 17:47:44,Twitter Web App,0,0
1192136495492149248, t ,2019-11-06 17:47:44,Twitter Web App,0,4
1192136493675864064,RT Avengers Oh snap AvengersEndgame is coming to DisneyPlus Start streaming the epic finale to Marvel Studios Infinity Saga on Novem ,2019-11-06 17:47:43,Twitter for Android,0,1561
1192136490802745345,2 Many ISI agents arr ,2019-11-06 17:47:42,Twitter for Android,0,448
1192136490077306880,RT MaryamMonsef We must all do our part to combat climate change Random Acts of Green s mobile app provides environmentally friendly tip ,2019-11-06 17:47:42,Twitter for iPhone,0,4
1192136487258787846,Imagine if an ,2019-11-06 17:47:42,Twitter for iPad,0,111
1192136484804952064,RT Marvel Oh snap AvengersEndgame is coming to DisneyPlus Start streaming the epic finale to Marvel Studios Infinity Saga on Novembe ,2019-11-06 17:47:41,Twitter for iPhone,0,445
1192136484146442240,RT Microsmallbusi1 Startup Canada scotiabank Company may be new but the founders and co founders have read and understood the market ,2019-11-06 17:47:41,Twitter Web App,0,1
1192136483454377984,RT CBCManitoba Winnipeg Jets Bryan Little gets 25 30 stitches after puck to head ,2019-11-06 17:47:41,Twitter for iPhone,0,3
1192136480178745344,5 Austra ,2019-11-06 17:47:40,Twitter for iPhone,0,69
1192136479373434884,RT JoshSmee I woke up this morning to news of a tragedy in my neighbourhood Thread ahead ,2019-11-06 17:47:40,Twitter Web App,0,2
1192136478320742402,Dutch people to the rest of the world when a Disney press release mentions US Canada and our small country ,2019-11-06 17:47:39,Twitter for iPhone,1,0
1192136476970098688,RT angus davison We obtained whole genome shotgun sequences of all 845 butterfly species recorded from the United States and Canada htt ,2019-11-06 17:47:39,Twitter for iPhone,0,261
1192136474688475138,Virginia elects woman who gave president the finger ,2019-11-06 17:47:39,Twitter Web App,0,0
1192136472759025664,RT HeidiCramm If you re interested in learning more about how the Australian military family compares to those in Canada the UK and US ,2019-11-06 17:47:38,Twitter Web App,0,9
1192136472574472194,So many ignorant to the dire impacts a shut down of Canada s O amp G sector would have on our economic well ,2019-11-06 17:47:38,Twitter Web App,0,53
1192136469671895040,RT mcranium92 Do you know a motivated student from the US Canada Ireland or the UK who would like to spend up to three months of fossil ,2019-11-06 17:47:37,Twitter Web App,0,12
1192136468447158273, CaringInfo It going to break the economy if the other extreme stuff doesn t first eg CA property insurance collaps ,2019-11-06 17:47:37,Twitter for Android,0,0
1192136465154822151, tbt instagood instamood follow4like followers f4f followforfollowbak likeforlikes likesforlikesback ,2019-11-06 17:47:36,Twitter for Android,1,0
1192136462160019457,Like that s going ,2019-11-06 17:47:36,Twitter Web App,0,0
1192136461430280193,RT JesterBrazen StartupChats Competitive Advantage Location and Relationship Building first come to mind Your client has finite res ,2019-11-06 17:47:35,Twitter Web App,0,1
1192136461111267328,Alberta separatist group applies to become federa ,2019-11-06 17:47:35,Twitter Web Client,0,0
1192136455398674433,3 Canadian Armed Forces members and v ,2019-11-06 17:47:34,Twitter for iPhone,0,2
1192136453943386117,This was due to a performance of the song on The Voice ,2019-11-06 17:47:34,Twitter Web App,0,64
1192136453217603584,RT realBrianReid CPC HQ AndrewScheer Please vote for AndrewScheer he ll give us a better chance at forging laws in Canada that ll ,2019-11-06 17:47:33,Twitter Web App,0,1
1192136448545304577,RT FAONorthAmerica Canada2020 AAFC Canada FAOIndigenous Climate change and trans boundary diseases like African Swine Fever ASF are ,2019-11-06 17:47:32,TweetDeck,0,1
1192136444657176577,What was the name of the land in western Canada prior to being named Alaska ,2019-11-06 17:47:31,Twitter for iPhone,3,1
1192136443914788864,RT ArleneDickinson Canada is not perfect but it s an amazing country Separating from it makes no sense we re stronger as a country tog ,2019-11-06 17:47:31,Twitter Web App,0,69
1192136443553959936,2 Many ISI agents arr ,2019-11-06 17:47:31,Twitter Web App,0,449
1192136440634847242, Canada Gun Club Michell82410861 I feel safer already The criminals must be shaking in their boots on this news ,2019-11-06 17:47:30,Twitter for iPhone,0,0
1192136439208796160,RT pressfreedom Authorities in the Six Nations Territory in Canada should conduct a prompt and thorough investigation into an arson atta ,2019-11-06 17:47:30,Twitter Web App,0,8
1192136438478966784,We are pleased to announce Roberta Jamieson RobertaIndspire as our Keynote for our Top 100 Awards Gala on Nov 21st ,2019-11-06 17:47:30,Twitter Web App,0,0
1192136437845676034,RT unhealthytruth This is happening in Canada but receiving very little attention Our thought are with this sweet girl s family and espe ,2019-11-06 17:47:30,Twitter for Android,0,2
1192136432963309569, MerlinofCanada mustangmadd When the call for separatism first appeared in Quebec the first thing taxpayers saw w ,2019-11-06 17:47:29,Twitter Web App,0,0
1192136431524691974,2 Many ISI agents arr ,2019-11-06 17:47:28,Twitter for Android,0,449
1192136429801005057,Keep the corrupt UnitedNations out of Canada ,2019-11-06 17:47:28,Twitter Web App,1,0
1192136428714524672,RT YeoKHamster hoccgoomusic Wt Is Canada sure that s who they want to learn from ,2019-11-06 17:47:28,Twitter for Android,0,1
1192136428341194752,RT DannyHozack OK let me explain this to you sloooowly MaximeBernier is not speaking about separation He is the keynote speaker in t ,2019-11-06 17:47:27,Twitter for Android,0,63
1192136425866715138,2 Many ISI agents arr ,2019-11-06 17:47:27,Twitter for iPhone,0,449
1192136423463276544,RT cathmckenna Great piece TheTurner I absolutely agree that Canada can be a model for how a resource driven economy can move to a low ,2019-11-06 17:47:26,Twitter for Android,0,46
1192136417415254017,RT downtownrob88 Canada barely averted Quexit in the 50 5 49 5 result in the 1995 referendum The country has been here before ,2019-11-06 17:47:25,Twitter Web App,0,8
1192136414663708673, ChrisGZuger scotiabank Would you say those points who they are what they charge what they offer and why peopl ,2019-11-06 17:47:24,Twitter Web App,2,1
1192136413233340417,2 Many ISI agents arr ,2019-11-06 17:47:24,Twitter Web App,0,449
1192136411237036032,RT MarvelStudios Oh snap Avengers Endgame is coming to DisneyPlus Start streaming the epic finale to Marvel Studios Infinity Saga on ,2019-11-06 17:47:23,Twitter for iPad,0,1261
1192136402420600832, IkhenaniGoesInternational ,2019-11-06 17:47:21,Twitter for iPhone,38,5
1192136402248650753,Tbh I try to not black pill to much but Canada is so irredeemable fucked it s gone and it s not coming back,2019-11-06 17:47:21,Twitter Web App,0,0
1192136399761420289, sweatscience Ahhhhhhhhhhh HES from Canada all makes sense now LMAOOOOOOOOO,2019-11-06 17:47:21,Twitter for iPhone,0,0
1192136393520234499,They say 26 year old Deborah Oguntoyi ,2019-11-06 17:47:19,Twitter for Android,0,185
1192136393054736384, cribbingarmydav BrettCMajor1 Ok but everything sacred to Canada has to be gay no I respectfully disagree we ,2019-11-06 17:47:19,Twitter Web App,1,0
1192136384011587585,Joshua Gold Resources is a US gold exploration company headquartered in Canada engaged in the exploration of highl ,2019-11-06 17:47:17,Twitter Web App,0,0
1192136380081557504,Maybe it s time that Quebec started contributing to the rest of Canada instead of just taking and taking ,2019-11-06 17:47:16,Twitter for Android,0,0
1192136379586752519,RT ABoipc Canada s federal provincial and territorial Information and Privacy Commissioners renewed their call for effective privacy and ,2019-11-06 17:47:16,Twitter for Android,0,1
1192136378626109440,CETA cannot happen ,2019-11-06 17:47:16,Twitter Web App,0,0
1192136377455890437, Startup Canada A8 Focus is key Be really good at that and provide excellent customer service Get feedback Try i ,2019-11-06 17:47:15,Twitter Web App,4,1
1192136371332358144,A powerful loop of filling hearts with happiness Thank you to TD Canada amp kidsbookcentre for the Gr 1 Book Give ,2019-11-06 17:47:14,Twitter Web App,0,0
1192136371298803713,Authorities in the Six Nations Territory in Canada should conduct a prompt and thorough investigation into an arso ,2019-11-06 17:47:14,Twitter Web App,8,8
1192136369507885056,RT BBCWorld Trump impeachment hearings to go public next week ,2019-11-06 17:47:13,Twitter Web App,0,190
1192136359600885762, lataviatweets I feel like yes because US schools have everything automated accesible and easy for them They also ,2019-11-06 17:47:11,Twitter for iPhone,0,0
1192136355028979712,RT TerryCookeHCF My hometown HamOnt is truly Canada s comeback city Lots of challenges remain but we will face them head on as we alw ,2019-11-06 17:47:10,Twitter for Android,0,13
1192136354316066816,RT MarkChapeskie There is a big talent supply issue in Canada s IT IS and cyber space and this is having a direct impact on the energy s ,2019-11-06 17:47:10,Twitter for Android,0,1
1192136353498247168,RT Marvel Oh snap AvengersEndgame is coming to DisneyPlus Start streaming the epic finale to Marvel Studios Infinity Saga on Novembe ,2019-11-06 17:47:10,Twitter for Android,0,445
1192136343788441601,He continues to throw the most vulnerable under the bus while he hands o ,2019-11-06 17:47:07,Twitter Web App,0,2
1192136343410724864,RT dubsndoo Brad it doesn t seem to matter to central Canada that western alienation is warranted Can you imagine the howls of outrage ,2019-11-06 17:47:07,Twitter Web App,0,3
1192136342718865408,RT MarvelStudios Oh snap Avengers Endgame is coming to DisneyPlus Start streaming the epic finale to Marvel Studios Infinity Saga on ,2019-11-06 17:47:07,Twitter for iPhone,0,1261
1192136341817057280,Canada 45 ,2019-11-06 17:47:07,Twitter for Android,0,419
1192136341569626112,RT KevinFrankish Don t be fooled by call display Be cynical of any call that 1 Asks you to withdraw cash 2 Intimidates or scares you ,2019-11-06 17:47:07,Twitter Web App,0,88
1192136341015810048,Want to work at Allied Universal We re hiring in Oakville ON Canada Click the link in our bio for details on th ,2019-11-06 17:47:07,CareerArc 2.0,0,0
1192136339694792705,RT disneyplus Oh snap AvengersEndgame is coming to DisneyPlus Start streaming the epic finale to MarvelStudios Infinity Saga on Nov ,2019-11-06 17:47:06,Birdie for Twitter,0,797
1192136336414846977,RT ZacharyPetit I recently went on assignment to Canada to interview and photograph the brilliant cartoonist SETH for Eye on Design It w ,2019-11-06 17:47:06,Twitter Web App,0,5
1192136333952720896,RT wnbma Do not book a flight to Canada with Air Transat our flight has been changed dramatically and no compensation offered,2019-11-06 17:47:05,Twitter for iPhone,0,1
1192136333189427201,RT CityofPortage A week long Identification Fair will be held at the Herman Prior Centre Dec 2 6th 2019 Services will include Status ,2019-11-06 17:47:05,Twitter Web App,0,1
1192136329729056775,RT TomMay1 With World Rugby announcing they are looking at dual hosting options for 2027 amp 2031 it seems more than likely we lol see the ,2019-11-06 17:47:04,Twitter Web App,0,11
1192136329292894209, sugarbabywanted SugarDaddys I want to be your sugar mummy I do not want sex or nudes First 100 people who reply ,2019-11-06 17:47:04,Twitter for Android,1,0
1192136328739033089,2 Many ISI agents arr ,2019-11-06 17:47:04,Twitter for Android,0,449
1192136327824904192,RT BrettCMajor1 Lawrence Solomon Trudeau stands alone as Canada and the world abandons green energy Financial Post ,2019-11-06 17:47:04,Twitter Web App,0,210
1192136327522930688, cathmckenna theturner Excellent ambition for Canada And of course for the world as well ,2019-11-06 17:47:03,Twitter Web App,0,0
1192136324180000768,Canada Toronto Star Bill addresses pensions health care for miners retirees More HealthCare news ,2019-11-06 17:47:03,Health Care Headlines,0,0
1192136321952813061,RT ACADA Atlantic chantierdavie federalfleet CoastGuardCAN demonstrate and highlight the importance of having gov and industry wor ,2019-11-06 17:47:02,Twitter for iPhone,0,1
1192136321474560000,Trudeau Canada to Resume Pork Beef Shipments to China ,2019-11-06 17:47:02,dlvr.it,0,0
1192136321097175040,RT MarvelStudios Oh snap Avengers Endgame is coming to DisneyPlus Start streaming the epic finale to Marvel Studios Infinity Saga on ,2019-11-06 17:47:02,Twitter for Android,0,1261
1192136320119738369,RT CBCToronto Don t do it Canada That s the essence of a blunt warning from former U S national security adviser Susan Rice who is cl ,2019-11-06 17:47:02,Twitter Web App,0,239
1192136319742275584,RT Victoria59L Canada Gun Club DCTFTW Oh yes because criminals follow the law ,2019-11-06 17:47:02,Twitter for Android,0,2
1192136318928572416,2 Many ISI agents arr ,2019-11-06 17:47:01,Twitter for Android,0,449
1192136317276176386,RT SBBCFFKrokodil Replace Democrat with Liberal and state with province and you have the T2 Buttz cabal plan for Canada ,2019-11-06 17:47:01,Twitter Web App,0,2
1192136313664753665,Time to buy a forever coffee sleeve 3 from the 5 cost goes the lfcdogguides November the donations are matched ,2019-11-06 17:47:00,Instagram,0,0
1192136313438457857,RT chandar2020 SenatorDurbin SenateDems Senator Durbin the so called 20 countries you mentioned in the Senate Floor that people from ,2019-11-06 17:47:00,Twitter for iPhone,0,32
1192136310053408768,CANADA DAY IS HERRREE,2019-11-06 17:46:59,Twitter for iPhone,0,0
1192136307964661760,Worth a look HTAi Asia Policy Forum Background Paper Sustainability of Healthcare systems in Asia Role of Horiz ,2019-11-06 17:46:59,Twitter Web App,0,0
1192136306010124288, defundcbc defundthecbc trudeauhypocrite ,2019-11-06 17:46:58,Twitter Web App,1,0
