id,tweet_text,tweet_created,source,favorite_count,retweet_count
1192134988164034560,Seals amp Whales Marine Land in Canada LOVE it They are so happy they are kissing everyone SO SWEET ,2019-11-06 17:41:44,twittbot.net,0,0
1192134985999945728, ciara beliebs Thats already better than me i m in canada so i gotta pay the conversion and if i pay by credit ,2019-11-06 17:41:44,Twitter for iPhone,0,0
1192134985358069761,RT NYTScience A contagious cancer appeared in shellfish off the coast of Canada How did it get to France and Chile Cargo ships scienti ,2019-11-06 17:41:43,Twitter for iPhone,0,23
1192134982770339840,2 Many ISI agents arr ,2019-11-06 17:41:43,Twitter for Android,0,454
1192134981113565184,Imagine if an ,2019-11-06 17:41:42,Twitter Web App,0,112
1192134980668940290,RT RapSheet Another frustrating injury for Giants TE Evan Engram Coach Pat Shurmur tells reporters Engram has a mid foot sprain and is ,2019-11-06 17:41:42,Twitter for iPhone,0,104
1192134978047340544,2 Many ISI agents arr ,2019-11-06 17:41:42,Twitter for Android,0,454
1192134977476972544,RT sarbjitkaur1 I don t understand why this is getting so much coverage It s 150 disgruntled right winger types making mewling noises T ,2019-11-06 17:41:42,Twitter for Android,0,60
1192134977045041152,India 982 ,2019-11-06 17:41:41,Twitter Web App,0,41
1192134976655044608,My cousin got diagnosed with cancer stage 4 with lymphoblastic lyphoma My aunt is a single mother with 4 ,2019-11-06 17:41:41,Twitter for iPhone,0,43
1192134974524317697,RT HarperCollinsCa In her newest book bestselling author and founder of the SimplifiedPlanner EmilyLey brings a revolutionary explora ,2019-11-06 17:41:41,AgoraPulse Manager,0,0
1192134971370168330,RT inndstock INND Establishes a Distribution Warehousing amp Manufacturing Agreement in Canada amp the UnitedStates with EastWestbiosci ,2019-11-06 17:41:40,Twitter Web App,0,5
1192134967687557121, northernck The total right of centre vote in Canada hasn t change much since the Mulroney days The swing vote as ,2019-11-06 17:41:39,Twitter for iPhone,0,0
1192134965288488961,Inuit help Innu as Nunatsiavut lends support to Sheshatshiu suicide crisis CBC News ,2019-11-06 17:41:39,Twitter Web Client,0,0
1192134960976666624,Had a good meeting with RepRichardNeal and his colleagues from the Ways amp Means Committee today We talked about t ,2019-11-06 17:41:38,Twitter for iPhone,162,22
1192134959735222272,RT NHenryFundi There has to be a reckoning of the fact that race and racism are part of the establishment amp maintenance of public educati ,2019-11-06 17:41:37,Twitter for Android,0,12
1192134956904075266,RT ZackCoxNESN Chung played just 38 6 of snaps Sunday night after being listed as questionable with chest heel injuries Watson played e ,2019-11-06 17:41:37,Twitter for iPhone,0,2
1192134955490578439, jennypowpow5141 Great question Thanks for considering TD for your mortgage needs We can definitely provide infor ,2019-11-06 17:41:36,ITC Enterprise,1,0
1192134953913348096,Imagine if an ,2019-11-06 17:41:36,Twitter Web App,0,112
1192134950591426560,2 Many ISI agents arr ,2019-11-06 17:41:35,Twitter for Android,0,454
1192134947001307136,RT nspector4 No one can begrudge Trudeau taking a break after a gruelling elxn43 campaign to recharge his batteries Flying across Canad ,2019-11-06 17:41:34,Twitter for Android,0,270
1192134944933339136, ctvedmonton Just think what we could do with that 20 billion going to eastern Canada ,2019-11-06 17:41:34,Twitter for iPhone,0,0
1192134944132390914,RT Starbucks Turn on your cheer the holidays are back tomorrow Nov 7 Purchase a handcrafted holiday beverage and get a Reusable R ,2019-11-06 17:41:34,Twitter for iPhone,0,752
1192134940697083904,The land locking of Canadian energy has created a huge transfer of wealth from ,2019-11-06 17:41:33,Twitter for Android,0,923
1192134939749310464,RT RepMGS We should be leading this charge not missing in action ,2019-11-06 17:41:33,Twitter Web App,0,18
1192134939518685186,RT althiaraj Why and how JustinTrudeau didn t lose the election My longread on the liberal party s 2019 campaign This is for all th ,2019-11-06 17:41:33,Twitter for iPhone,0,163
1192134939518685185,Take this quiz ,2019-11-06 17:41:33,Twitter Web App,0,3
1192134939246039046,RT pauljimerson You can t hide in Canada GretaThunberg ,2019-11-06 17:41:32,Twitter Web App,0,1
1192134938436370432,RT SaraGideon About 15 000 Mainers rely on our lobster industry which has a more than 1 billion impact on our economy annually We need ,2019-11-06 17:41:32,Twitter for Android,0,70
1192134938209898496,RT jeremyarun kenapa korang kena libatkan bangsa dan agama in literally everything eh it s so suffocating lah if Canada can elect Sunni ,2019-11-06 17:41:32,Twitter for Android,0,19
1192134935617781760,Imagine if an ,2019-11-06 17:41:32,Twitter Web App,0,112
1192134935131254784,RT PeterBrannen1 Sometimes I remember that there s a gigantic almost perfectly circular 280 mile diameter arc in Canada and that no one ,2019-11-06 17:41:31,Twitter for iPhone,0,298
1192134933487243274,17 Fr ,2019-11-06 17:41:31,Twitter for Android,0,2540
1192134933021626371,Privately owned forest groves were believed used in the ,2019-11-06 17:41:31,Twitter for iPhone,0,131
1192134927627825152,Our friends at DAZN CA are airing our Wednesday m ,2019-11-06 17:41:30,Twitter for iPhone,0,6
1192134926088359936,Imagine if an ,2019-11-06 17:41:29,Twitter Web App,0,112
1192134923529777153,RT TerryGlavin If you re even remotely interested in the tragic human terrain at the interstices of inequality multiculturalism racism ,2019-11-06 17:41:29,Twitter Web App,0,16
1192134923139854337,RT MerlinofCanada Scammers spoofing more than a dozen federal government departments to defraud Canadians they have your SIN and your cal ,2019-11-06 17:41:29,Twitter for iPad,0,10
1192134920488964096,2 Many ISI agents arr ,2019-11-06 17:41:28,Twitter for Android,0,454
1192134916198285314,RT BBCWorld Trump impeachment hearings to go public next week ,2019-11-06 17:41:27,Twitter for Android,0,190
1192134915820859392, GonzoLodge BrighthouseFin Get ready to pay 70 percent in taxes from your wages Talk the any Canadian It will al ,2019-11-06 17:41:27,Twitter for iPhone,0,0
1192134913488756737, attackonadz If you live in US it s normal people are not use to African cultures dishes etc lol in Canada and Euro ,2019-11-06 17:41:26,Twitter for iPhone,1,0
1192134911030902787, clint4usa TheRightMelissa DonaldJTrumpJr Energy companies do business with Ukraine Russia Saudi Arabia Chile ,2019-11-06 17:41:26,Twitter for Android,0,0
1192134907713208320,RT RapSheet With Eagles WR DeSean Jackson on Injured Reserve after surgery source say Philly is re signing an old friend Jordan Matthe ,2019-11-06 17:41:25,Twitter for iPhone,0,502
1192134905863426048,RT MerlinofCanada I was in business in Calgary for 35 years and I do not know one person who would want to separate from Canada not one ,2019-11-06 17:41:25,Twitter for Android,0,119
1192134905486020611,can lana pls extend the nfr tour and do a leg in canada before i literally cry,2019-11-06 17:41:24,Twitter Web App,0,0
1192134901824458754,RT squad wonho eshygazit MonstaX Canada OfficialMonstaX OK BUT ARENT YOU GONNA HELP US BRING HIM BACK SIR Hellooooo,2019-11-06 17:41:24,Twitter for iPhone,0,1
1192134897676230656,RT uvic The IDeA Canada student competition is now open Check out this exciting opportunity for university students across Canada http ,2019-11-06 17:41:23,Twitter Web App,0,1
1192134897101619201, sandeeprrao1991 Pardon my ignorance but when Air France BA Air Italia Air Canada even United can and operate ,2019-11-06 17:41:22,Twitter for Android,0,0
1192134896531042306,RT HillelNeuer BREAKING Head of UN refugee agency for Palestinians who said he would not stand down until end of probe into his sexual m ,2019-11-06 17:41:22,Twitter for iPhone,0,125
1192134891753873408, environment marketing A ,2019-11-06 17:41:21,Twitter for iPhone,0,13
1192134891531575296,There has been a lot of buzz about Regenerative Agriculture farming practices that increase biodiversity and enri ,2019-11-06 17:41:21,Twitter for iPhone,0,0
1192134891464318981,RT northernck Funny how when a piss poorly managed company leaves Canada its Trudeau s fault But when Trudeau s team negotiated reopenin ,2019-11-06 17:41:21,Twitter for iPhone,0,137
1192134887769174016,RT sarbjitkaur1 I don t understand why this is getting so much coverage It s 150 disgruntled right winger types making mewling noises T ,2019-11-06 17:41:20,Twitter for iPhone,0,60
1192134886586560514, jamesBowen2015 StartUpCanada Simple truths are simply true StartupChats,2019-11-06 17:41:20,Twitter Web App,0,0
1192134885978333184,Imagine if an ,2019-11-06 17:41:20,Twitter for Android,0,112
1192134883524726785,I just asked question canadafoodbrand how do we market Canada Brand How do we get msm to cover cdnag stories ,2019-11-06 17:41:19,Twitter for iPhone,0,0
1192134882920677376,RT IWO org Support group for injured workers in Windsor lets them know they re not alone CBC News ,2019-11-06 17:41:19,Twitter for Android,0,6
1192134881926467585,85 of the world s developed ,2019-11-06 17:41:19,Twitter for iPhone,0,0
1192134874167050241,RT EXORadioproject The Amazon link for OBSESSION has arrived though it is currently SOLD OUT ask them to restock USA Puerto Rico Canad ,2019-11-06 17:41:17,Twitter Web App,0,109
1192134873806323712,2 Many ISI agents arr ,2019-11-06 17:41:17,Twitter for Android,0,454
1192134872963452929,The land locking of Canadian energy has created a huge transfer of wealth from ,2019-11-06 17:41:17,Twitter Web App,0,923
1192134867863134208,RT RepMGS We should be leading this charge not missing in action ,2019-11-06 17:41:15,Twitter Web App,0,18
1192134866378350597,RT ezlazar Patrick Chung and Ben Watson missing from Patriots practice on Wednesday ,2019-11-06 17:41:15,Twitter for iPhone,0,6
1192134864318844929,2 Many ISI agents arr ,2019-11-06 17:41:15,Twitter for Android,0,454
1192134863031279617,RT CBCIndigenous Sask defence lawyers applaud Ont judge s ruling allowing jury selection challenges ,2019-11-06 17:41:14,Twitter for iPhone,0,4
1192134861781438464,RT CanadianPrivacy Scammers spoofing more than a dozen federal government departments to defraud Canadians ,2019-11-06 17:41:14,TweetDeck,0,1
1192134858107080704, Chipnaputt27 GarnettGenuis JJ McCullough a more complete answer various studies consistently show Canada in the ,2019-11-06 17:41:13,Twitter Web App,0,0
1192134858019131394,RT MHairkoh Nigerians in Canada you peeps better respect yourself where you are and live right cos I see some of you have started ruini ,2019-11-06 17:41:13,Twitter for Android,0,3
1192134856123256832,RT kaisercatcinema Kaiser Cat Cinema x Hussard pt 3 This time we commissioned Hussard to give us his impression of a scene that takes pl ,2019-11-06 17:41:13,Twitter Web App,0,15
1192134855322210304,WHAT A COUNTRY ,2019-11-06 17:41:12,Twitter Web Client,0,0
1192134854617501696, LaBeardGuy It s really sad that I have lived in Canada my whole life and know more about the weapons available in ,2019-11-06 17:41:12,Twitter Web App,1,0
1192134854013595649, Canada has long touted itself as a global leader in welcoming refugees But the use of the Immigration Loans Progr ,2019-11-06 17:41:12,Hootsuite Inc.,0,0
1192134853845749762,India ,2019-11-06 17:41:12,IFTTT,0,0
1192134853791305728, twatterfull AquaVelvaBoy CitImmCanada CAN BEAR AND HONEYBEE RESERVE SPOT IN LINE NOW PLEASE AND THANK YOU AND ,2019-11-06 17:41:12,Twitter Web Client,6,1
1192134849819107328, albertaseparation WEXITALBERTA We are incompatible with the rest of Canada We are completely different amp our pr ,2019-11-06 17:41:11,Twitter Web App,0,0
1192134848732745728,The journey of getting to Victoria is almost as good as the destination itself This morning light ab ,2019-11-06 17:41:11,Twitter Web App,0,6
1192134847176810497,RT MarvelStudios Oh snap Avengers Endgame is coming to DisneyPlus Start streaming the epic finale to Marvel Studios Infinity Saga on ,2019-11-06 17:41:11,Twitter for iPhone,0,1263
1192134838318518273, Startup Canada scotiabank As the saying goes Money talks and shit walks startup scotiabank StartupChats,2019-11-06 17:41:08,Twitter Web App,1,0
1192134835973828608,RT Avengers Oh snap AvengersEndgame is coming to DisneyPlus Start streaming the epic finale to Marvel Studios Infinity Saga on Novem ,2019-11-06 17:41:08,Twitter for Android,0,1565
1192134835738959873,RT OsteoporosisCA Osteoporosis Canada staff are wearing their purpleproud today in support of the 2 million women and men impacted by o ,2019-11-06 17:41:08,Twitter for iPad,0,5
1192134835030106112,LATEST TrumpImpeachment hearings to go public next week What happens next in impeachment process ,2019-11-06 17:41:08,Twitter Web App,0,0
1192134834833035264,Scammers spoofing more than a dozen federal government departments to defraud Canadians ,2019-11-06 17:41:08,TweetDeck,0,1
1192134833209856001,RT Norah Holder VMPC Canada PAVRO LIVE VMPNS VMPNB VolunteerCanada VolunteerALIVE All the best amp thank you to CollingwoodHosp Vo ,2019-11-06 17:41:07,Twitter for iPhone,0,1
1192134832698077185,Whatever and whoever you want to blame it on its so obvious that Scheer Kenney Ford Ezra Lilley and your bought an ,2019-11-06 17:41:07,Twitter for Android,0,0
1192134829288148993,RT CanadianPain With the estimated direct and indirect costs of ChronicPain totalling 56 to 60 billion per year we need more Awarene ,2019-11-06 17:41:06,Twitter for iPhone,0,7
1192134825945243649, NandosPeriPeri I did last night So glad we have it in Canada now,2019-11-06 17:41:05,Twitter for iPhone,0,0
1192134825227931648,Community Living Toronto is hiring in Toronto ON Canada Read about our latest Welfare job opening via the link i ,2019-11-06 17:41:05,CareerArc 2.0,0,0
1192134819662065664,India 982 ,2019-11-06 17:41:04,Twitter for iPhone,0,41
1192134816851988480, djclimenhaga Am I correct in understanding that Wexit is the idea of Alberta exiting Canada I m from Mexico and ,2019-11-06 17:41:03,Twitter Web App,0,0
1192134814721134592, oilers4thewin As far as I can tell it s an American Canadian thing I ve never heard someone on a sitcom offer ,2019-11-06 17:41:03,Twitter for Android,2,0
1192134805623902208,RT jillguerra On improving Canada s food system It s not about bringing indigenous knowledge into a western model it s about bringing ,2019-11-06 17:41:01,Twitter for iPhone,0,5
1192134805112131584,RT NatCitizens NICE COUNTRIES FINISH LAST Trudeau s Canada is too nice to fight for Western jobs too nice to stand up to Communist Chin ,2019-11-06 17:41:00,Twitter for iPhone,0,11
1192134802683650055,RT Mikeggibbs Mulroney even validated disinformation that erases a key chapter of Canadian history in which her father played a pivotal r ,2019-11-06 17:41:00,Twitter for iPhone,0,1
1192134799529562114,RT cactus12345 MostHated1lol welcome to Canada MH1 Our PM loves blackface apparently media BLM and Liberals don t believe anything is ,2019-11-06 17:40:59,Twitter Web App,0,1
1192134799487574016,RT Avengers Oh snap AvengersEndgame is coming to DisneyPlus Start streaming the epic finale to Marvel Studios Infinity Saga on Novem ,2019-11-06 17:40:59,Twitter for iPhone,0,1565
1192134799193989120,RT Lordbrexit Are there any out there wanting s simple free trade deal like Japan or Canada With the option to walk away with a clean b ,2019-11-06 17:40:59,Twitter for iPhone,0,14
1192134798929625088,RT Avengers Oh snap AvengersEndgame is coming to DisneyPlus Start streaming the epic finale to Marvel Studios Infinity Saga on Novem ,2019-11-06 17:40:59,Twitter for iPhone,0,1565
1192134796031512581,What bad night for Trump means for 2020 via Flynx,2019-11-06 17:40:58,Twitter for Android,0,0
1192134794097938432,RT ZosiaBielski Women facing sexual coercion at precarious low wage workplaces have been largely left out of MeToo women working in fa ,2019-11-06 17:40:58,Twitter for iPhone,0,26
1192134792378277888, Employed the Notwithstanding C ,2019-11-06 17:40:57,Twitter for iPhone,0,2
1192134787290370048,RT northernck Funny how when a piss poorly managed company leaves Canada its Trudeau s fault But when Trudeau s team negotiated reopenin ,2019-11-06 17:40:56,Twitter for iPhone,0,137
1192134783775760384,ABC stopped Epstein report amid Palace threats ,2019-11-06 17:40:55,Facebook,0,0
1192134781921906697,RT MarvelStudios Oh snap Avengers Endgame is coming to DisneyPlus Start streaming the epic finale to Marvel Studios Infinity Saga on ,2019-11-06 17:40:55,Twitter Web App,0,1263
1192134779052933121,RT Clmumme Today in Canadian gig worker law hearing and rally of Foodster workers trying to unionize in Toronto and Heller v Uber argum ,2019-11-06 17:40:54,Twitter Web App,0,5
1192134777035526144, Startup Canada scotiabank A8 Stress your niche have value added services competitive pricing exceptional custo ,2019-11-06 17:40:54,Twitter Web App,3,2
1192134766943854592, mccafe Served by a senior McDonald s Canada ,2019-11-06 17:40:51,Instagram,0,0
1192134764498571269,World s First Robotic Brain Surgery Could Be Game Changer For Patients Digital Trends ,2019-11-06 17:40:51,Twitter for iPhone,0,0
1192134761092964352,RT KevinFrankish Don t be fooled by call display Be cynical of any call that 1 Asks you to withdraw cash 2 Intimidates or scares you ,2019-11-06 17:40:50,Twitter for Android,0,88
1192134756961542144, ,2019-11-06 17:40:49,Vancouver News Bot,0,4
1192134746391773184,RT ABIndependence kevinolearytv You can draw a straight line to JustinTrudeau and the liberal party for every problem Canada is facin ,2019-11-06 17:40:46,Twitter Web App,0,2
1192134742558347265,RT activehealthyk1 New pub alert PhysicalActivity mediates the relationship between outdoor time and MentalHealth This analysis of ,2019-11-06 17:40:46,Twitter Web App,0,7
1192134741861945344,RT JBCrewdotcom Today marks 10 years since the last show of Justin Bieber s Urban Behavior Tour which was his debut tour with 5 shows ac ,2019-11-06 17:40:45,Twitter for Android,0,42
1192134741455187969,Imagine if an ,2019-11-06 17:40:45,Twitter for iPad,0,112
1192134739773153280,2 Many ISI agents arr ,2019-11-06 17:40:45,Twitter for Android,0,454
1192134739634749440,RT kittensaurusss Before the end of the year Greg meets PZ in person The first words he tells her are I can t wait to get you pregn ,2019-11-06 17:40:45,Twitter for Android,0,1
1192134738728902662,RT MarvelStudios Oh snap Avengers Endgame is coming to DisneyPlus Start streaming the epic finale to Marvel Studios Infinity Saga on ,2019-11-06 17:40:45,Twitter for iPhone,0,1263
1192134736656814081,But the biggest diff is definitely ,2019-11-06 17:40:44,Twitter for Android,0,82
1192134735918710786,RT OntShoresFdn Suicide is the second leading cause of death among 10 29 year olds in Canada Ontario Shores Foundation for Mental Health ,2019-11-06 17:40:44,Twitter for iPhone,0,1
1192134728834375680, CETA is an ideal platform for amp to continue to play roughshod over Climate Action ,2019-11-06 17:40:42,Twitter Web App,0,0
1192134727756591104,Prof Scott will be visiting ucddublin towards end of March 2020 let s meet and hear about TREKKca how this rese ,2019-11-06 17:40:42,Twitter for Android,0,0
1192134724761735168, AmazonHelps Amazon Canada doing it again Past 2 orders books were damaged and now this set of workout DVDs case i ,2019-11-06 17:40:41,Talon Android,0,0
1192134723025408002, Andrew Scheer s days are numbered 42 want him gone new poll finds ,2019-11-06 17:40:41,Twitter Web Client,3,2
1192134720345137152,Imagine if an ,2019-11-06 17:40:40,Twitter Web App,0,113
1192134719002968064,Back in Vancouver Canada Coast Salish territory for CleanEnergyBC Generate2019 It s world class town ,2019-11-06 17:40:40,Twitter for Android,1,0
1192134718050971649,RT DrJacobsRad With fines of 50 000 and the possibility of imprisonment for critique of politicians freedom of speech in Canada is offi ,2019-11-06 17:40:40,Twitter Web App,0,176
1192134717577056258,My cousin got diagnosed with cancer stage 4 with lymphoblastic lyphoma My aunt is a single mother with 4 ,2019-11-06 17:40:40,Twitter for iPhone,0,43
1192134717317013505,RT CTVVancouver The Canadian Down Syndrome Society has launched a campaign to help Google improve its voice recognition technology ,2019-11-06 17:40:40,Vancouver News Bot,0,3
1192134715974803456, BigGay Baby Haha yes Wish I could get the pizza delivered to Canada ,2019-11-06 17:40:39,Twitter for Android,1,0
1192134714716381184,So many ignorant to the dire impacts a shut down of Canada s O amp G sector would have on our economic well ,2019-11-06 17:40:39,Twitter for iPhone,0,53
1192134714523553793,RT jamesBowen2015 A9 every customer validates your strategy or not startupcanada startupchats,2019-11-06 17:40:39,Twitter Web App,0,1
1192134713739071488,Imagine if an ,2019-11-06 17:40:39,Twitter for iPhone,0,113
1192134712984137732,Ireland ,2019-11-06 17:40:39,Twitter for Android,0,127
1192134709993566209,That will be another HUGE savings for Western Canada not contribu ,2019-11-06 17:40:38,Twitter for Android,0,0
1192134700350836736,RT joececiyyc This just confirms what we all knew the UCP were lying about police funding cuts Would ChristineMyatt like to apologize ,2019-11-06 17:40:36,Twitter for Android,0,9
1192134699981754368,RT RepMGS We should be leading this charge not missing in action ,2019-11-06 17:40:35,Twitter for iPhone,0,18
1192134699369553920,RT McCreaImmLaw What happened to 3 stowaways in Argentia Border Services won t say CBC News cdnimm ,2019-11-06 17:40:35,Twitter Web App,0,2
1192134697763033088,Leaving the Canada Pension Plan could be Alberta s next shot across Ottawa s bow via nationalpost,2019-11-06 17:40:35,Twitter Web App,1,0
1192134696378847232,RT equal press ICYMI Meet our newest expert Maira Hassan Maira is a PhD student at AllardLaw with a research focus on aspects of con ,2019-11-06 17:40:35,Twitter for iPhone,0,1
1192134692528705543,RT LenardMonkman1 OPINION As a Crown prosecutor I saw how our justice system traumatizes Indigenous people CBC News ,2019-11-06 17:40:34,Twitter Web App,0,119
1192134691006111746,RT ChrisGZuger A6 You re a startup you re small nimble able to adapt cutting edge fresh and have the ability to shakeup the way th ,2019-11-06 17:40:33,Twitter Web App,0,2
1192134686325329921,Too many clicks Here s the executive summary ,2019-11-06 17:40:32,Twitter Web App,0,0
1192134685243191301,2 Many ISI agents arr ,2019-11-06 17:40:32,Twitter for Android,0,454
1192134677739560961, rodmickleburgh How odd that the federal government doesn t have the same expectations of Quebec Ontario and Atla ,2019-11-06 17:40:30,Twitter for iPad,1,0
1192134677521469441,RT of maIice Holy shit I can t believe I met my wife s boyfriend Troy in Toronto Ontario Canada he got me a 100 A amp W gift card and all ,2019-11-06 17:40:30,Twitter for iPhone,0,4
1192134676938276865, TheRealKeean spoke with co ,2019-11-06 17:40:30,Twitter for iPad,0,10
1192134675805831168, BradWall306 Sad really Thanks Canada,2019-11-06 17:40:30,Twitter for iPhone,0,0
1192134674841309185,2 Many ISI agents arr ,2019-11-06 17:40:29,Twitter for iPhone,0,454
1192134673675120640,Episode 12 Walking Infirmary is live We talk California Jets Canada Russia and Rage Against the Machine ,2019-11-06 17:40:29,Twitter Web App,1,0
1192134671972233216, BestStephen Lashing out Give your head a shake For many we are talking about their livelihood They have come ,2019-11-06 17:40:29,Twitter for iPhone,0,0
1192134669895995392, ArthurAtkinson0 Here is another comment for you DonMcLeod1977 I m an Albertan born and raised and I will stan ,2019-11-06 17:40:28,Twitter Web App,1,0
1192134668667301888,international spying program the Uranium One scandal US uranium was passed through Canada and the construction ,2019-11-06 17:40:28,Twitter Web App,0,0
1192134668075851776,RT OurCommons The War of 1812 Book of Remembrance commemorates over 1 600 individuals who gave their lives during the conflict while serv ,2019-11-06 17:40:28,Twitter for iPhone,0,7
1192134664766537738,Driverless Vehicles not legal in BC Canada wherever did anyone notice I ve dropped out ,2019-11-06 17:40:27,Twitter for Android,0,0
1192134663977848833,2 Many ISI agents arr ,2019-11-06 17:40:27,Twitter for Android,0,454
1192134662887358464, FarmRanger82 KornkvenJared Where do you buy them in Canada,2019-11-06 17:40:27,Twitter for iPhone,0,0
1192134659926192129, BBC Trump impeachment hearings to go public next week 2019 11 06 172148Z ,2019-11-06 17:40:26,Microsoft PowerApps and Flow,0,0
1192134656411553795,Imagine if an ,2019-11-06 17:40:25,Twitter for iPhone,0,113
1192134648794628096, Microsmallbusi1 scotiabank Any tips for positioning yourself as a thought leader when you re a brand new company StartupChats,2019-11-06 17:40:23,Twitter Web App,2,0
1192134647930609666, sugarbabywanted SugarDaddys I want to be your sugar mummy I do not want sex or nudes First 100 people who reply ,2019-11-06 17:40:23,Twitter for Android,0,0
1192134647876071425,Can someone go with me to Canada next Wednesday please please please I don t wanna go alone,2019-11-06 17:40:23,Twitter for iPhone,1,0
1192134645439025152,eating crepes for you in canada since you couldn t be there kennedisucks ,2019-11-06 17:40:22,Twitter for iPhone,1,0
1192134644633751553,RT veebrigham1 Wow yes Canada so awful known as the nicest country in the world free health care for all abortion is legal weed is leg ,2019-11-06 17:40:22,Twitter for iPhone,0,26
1192134640800284672,RT cblackst As a water crisis in non Indigenous communities in Canada hits the headlines it is worth noting that many First Nations have ,2019-11-06 17:40:21,Twitter for iPhone,0,363
1192134640234123265,Here s how much leave you ,2019-11-06 17:40:21,Twitter Web App,0,1186
1192134633342697472,It s Canada s business to ask anything we please You get paid ,2019-11-06 17:40:20,Twitter for iPhone,0,74
1192134631639773184,2 Many ISI agents arr ,2019-11-06 17:40:19,Twitter Web App,0,454
